{"inventorySchemaVersion":"1","inventoryId":"kit-reference-corpus","inventoryVersion":"1.0.0","generatorContractVersion":"1","generatorBuildId":"aisentinel-kit-reference-corpus@1","representationMode":"feature-level","entries":[{"scenarioId":"kit.abrupt-burst.v1","scenarioVersion":"1.0.0","family":"abrupt-burst","scenarioPath":"scenarios/kit.abrupt-burst.v1.json","scenarioSha256":"5382896ebb61fb454bd2f194da95d1e8baaecd5dd7e11dc81bf182f4778e42e3","seed":"kit-ref-abrupt-burst-1","corpusId":"corpus.kit.abrupt-burst.v1.5afeb4a4b099","corpusPath":"corpora/kit.abrupt-burst","representationMode":"feature-level","eventCount":10,"warmupEventCount":4,"evaluationEventCount":6,"eventsSha256":"47efcb142e571056e73d182aa25e2fd6e2a955112d990bc3079753f63cfd4643","annotationsSha256":"56c34d759d476e19c1bcc202cd137fde54bbcbe19c921e2d9b18ec9e66f25463","corpusManifestSha256":"6a3520349d002cde624b3a0ac3c1cf7ad950dd2d66758507d74c9314c53920ee","replayManifestSha256":"63d541cf51e70e8c3e4e129e8a122be7887ab320b934ec51a2be63da076ca96c"},{"scenarioId":"kit.endpoint-distribution-change.v1","scenarioVersion":"1.0.0","family":"endpoint-distribution-change","scenarioPath":"scenarios/kit.endpoint-distribution-change.v1.json","scenarioSha256":"3c3b87513951ef6f090d1823ffdf926b12698b43bc781eecf602474e6fbceb1b","seed":"kit-ref-endpoint-distribution-change-1","corpusId":"corpus.kit.endpoint-distribution-change.v1.4f4b67c6aead","corpusPath":"corpora/kit.endpoint-distribution-change","representationMode":"feature-level","eventCount":10,"warmupEventCount":4,"evaluationEventCount":6,"eventsSha256":"9d96f2439238ca2c3bfc6634c1a28fd2f971d126164d31c3412f31397e678135","annotationsSha256":"c4d9b889934f6bfdb687f25b24ff659529edec015a4cf6f52c4507467a8aa1c7","corpusManifestSha256":"da6c4f1ebb115b1b5170ae1b47040ad08808e0df4ff70ced5bcd0e7df03d4188","replayManifestSha256":"71f6683cb028a38c25a6c0b5237df8e80e7ffa7919f36d04669cabe2dce94c5d"},{"scenarioId":"kit.established-normal.v1","scenarioVersion":"1.0.0","family":"established-normal","scenarioPath":"scenarios/kit.established-normal.v1.json","scenarioSha256":"6f041f35695fd15573a43fdac60e744c0491c22d857c52edbc6cc63a80e5fe01","seed":"kit-ref-established-normal-1","corpusId":"corpus.kit.established-normal.v1.dffe70ac8547","corpusPath":"corpora/kit.established-normal","representationMode":"feature-level","eventCount":10,"warmupEventCount":4,"evaluationEventCount":6,"eventsSha256":"45cfab5a5e24a5f1495638f1af183de6358356d69a520b10c379c76ccec68817","annotationsSha256":"9591b87ac765a246a9886fe561c195815eacdbfdd0fd16dbd43e0e4e0c320a80","corpusManifestSha256":"5d51c3438172af5d42e65e60b49904410cdf8488122be9ae3bae88ed9ff5b9ef","replayManifestSha256":"f6e5ba435eaa6c1a87bd99a492b82ff066d667840cf56d438b36da5ac04d9855"},{"scenarioId":"kit.gradual-drift.v1","scenarioVersion":"1.0.0","family":"gradual-drift","scenarioPath":"scenarios/kit.gradual-drift.v1.json","scenarioSha256":"5b1fbc53f448c48619bc2f8a555d825a99baac620f92602497f401eee33b0642","seed":"kit-ref-gradual-drift-1","corpusId":"corpus.kit.gradual-drift.v1.8919ea58c9f2","corpusPath":"corpora/kit.gradual-drift","representationMode":"feature-level","eventCount":10,"warmupEventCount":4,"evaluationEventCount":6,"eventsSha256":"41ddd6068de54c910f27239c428b5f7d79d95a813b05711598fd02019b33b2b3","annotationsSha256":"f061cb3f01e8af0f5cb1f5706a4e6af4fe255980f0887d2ce4c8df8e423be2d7","corpusManifestSha256":"778a75b8452f479a05ad9daaf3b44ce233a222c03503b296ba3bbae32586fe51","replayManifestSha256":"c70a5c8260f5eab71689cd32ce6b40b73df35e8902c23dc5ed98b820eb0a495d"},{"scenarioId":"kit.identity-session-transition.v1","scenarioVersion":"1.0.0","family":"identity-session-transition","scenarioPath":"scenarios/kit.identity-session-transition.v1.json","scenarioSha256":"ad5a2b7db0e46eea923f1a818a824aca5d6f4d2e067affe67d2a996db56dab42","seed":"kit-ref-identity-session-transition-1","corpusId":"corpus.kit.identity-session-transition.v1.c6e02b593f8d","corpusPath":"corpora/kit.identity-session-transition","representationMode":"feature-level","eventCount":10,"warmupEventCount":4,"evaluationEventCount":6,"eventsSha256":"31560cb2d929ff56c256870f467e8926034a0791aadbe606428e973bfcda5534","annotationsSha256":"f9dc88068cbfeb164c0ea35856d513d3af46f4611de6814e0bd70b5e76083604","corpusManifestSha256":"3b5716a7f988823cb39df3d73ef2c010360b9ce2658cd614fd73f563d874732e","replayManifestSha256":"da6740e69a7c923af98f9242ef3b2f9ce470a64c0e7df278a57621d4565ddaec"},{"scenarioId":"kit.invalid-score-degradation.v1","scenarioVersion":"1.0.0","family":"invalid-score-degradation","scenarioPath":"scenarios/kit.invalid-score-degradation.v1.json","scenarioSha256":"f08c6844f8a57776793a987d24fcdb22fb5578abdf84368c453a4100ef7c8e65","seed":"kit-ref-invalid-score-degradation-1","corpusId":"corpus.kit.invalid-score-degradation.v1.502efc57f712","corpusPath":"corpora/kit.invalid-score-degradation","representationMode":"feature-level","eventCount":10,"warmupEventCount":4,"evaluationEventCount":6,"eventsSha256":"8286df25af8ae53867062577693d428b45b6916bae31d70aba2428b575b912da","annotationsSha256":"f84119aefccb174b3f697d4da8672b18651ee39c061f36621d3de764e49dbc19","corpusManifestSha256":"8b8dd1438975b5fb02766d69b7e5446fcb30be49d7b4455f530b1dab14a4e247","replayManifestSha256":"4f8f4be2e0a90e7fb95562c260a84a84845d8a9f320bcf817e0ccf9dd13ea720"},{"scenarioId":"kit.legitimate-burst.v1","scenarioVersion":"1.0.0","family":"legitimate-burst","scenarioPath":"scenarios/kit.legitimate-burst.v1.json","scenarioSha256":"1e46d6c8a54089b3388ddc53ea07053a6202891f1e492670d62accf1d411aadf","seed":"kit-ref-legitimate-burst-1","corpusId":"corpus.kit.legitimate-burst.v1.b2bf7088fe26","corpusPath":"corpora/kit.legitimate-burst","representationMode":"feature-level","eventCount":10,"warmupEventCount":4,"evaluationEventCount":6,"eventsSha256":"518706f155e516dd3698c2fc7fa5ef92ca323c09e5ddacdf362f31603222e12f","annotationsSha256":"dc6a87bd01fa6870efd9108fdc5206fc3d7387998f92a44cac4590ebe67da27e","corpusManifestSha256":"31be5feaeae875e3f3f6e2c71ea25d1c08b56c0f7219cf93be92cccd2c00e34c","replayManifestSha256":"0ac9ba716fc6c24a530aeeefd54216449c669b665217f3a6aabb40937c651618"},{"scenarioId":"kit.low-variance-deviation.v1","scenarioVersion":"1.0.0","family":"low-variance-deviation","scenarioPath":"scenarios/kit.low-variance-deviation.v1.json","scenarioSha256":"7d03b55d88ac163955c6a6e51bc931631fb9aa9f269245235559570754b33d90","seed":"kit-ref-low-variance-deviation-1","corpusId":"corpus.kit.low-variance-deviation.v1.eb2737ee8b17","corpusPath":"corpora/kit.low-variance-deviation","representationMode":"feature-level","eventCount":10,"warmupEventCount":4,"evaluationEventCount":6,"eventsSha256":"761204f49c094b8c96304d50733d76db703e8a083eaba6983e4e695676be7ecc","annotationsSha256":"d1f3b84986df389bb7b7b2301bebd097fc1fde71c8b6d0109c78424d2eb8954c","corpusManifestSha256":"777f8af8aefd9bf3124d5437ebac5ad99cdf6c5bc9653e8f3b67b6fe6a077db7","replayManifestSha256":"a9006289436f401ced62d3c3d4c5fd083f907ec7edd307c9d72325633ce51812"},{"scenarioId":"kit.multi-feature-anomaly.v1","scenarioVersion":"1.0.0","family":"multi-feature-anomaly","scenarioPath":"scenarios/kit.multi-feature-anomaly.v1.json","scenarioSha256":"475f53ce9f949df30ecc02b364e0a824bfdb0c73d39ac72168b04b422440d5fa","seed":"kit-ref-multi-feature-anomaly-1","corpusId":"corpus.kit.multi-feature-anomaly.v1.5f5f77f02747","corpusPath":"corpora/kit.multi-feature-anomaly","representationMode":"feature-level","eventCount":10,"warmupEventCount":4,"evaluationEventCount":6,"eventsSha256":"93ebc0f0d8dfb48ae1cbb358e42d5c9f4c441c76bbcf12656c516a4ae7450294","annotationsSha256":"3deacbdaaf9eff44cd33faac96b25c900de78a6b97cd7e7f2cb2b7351063b4ec","corpusManifestSha256":"338da9d1e704bf6139f910b7d7dd5eb6a04f863e83d579248ff7e43ffa16ad6e","replayManifestSha256":"9bc9038f5ea4fa5fbabb3f53d1abec4827a11352dcaf796969ff88f5c2117f86"},{"scenarioId":"kit.recovery.v1","scenarioVersion":"1.0.0","family":"recovery","scenarioPath":"scenarios/kit.recovery.v1.json","scenarioSha256":"376a37cd41ffe991b7f763cf2c5e86be5e47f67cad7ff8af00f69b0aac117c43","seed":"kit-ref-recovery-1","corpusId":"corpus.kit.recovery.v1.bb526d92cce4","corpusPath":"corpora/kit.recovery","representationMode":"feature-level","eventCount":10,"warmupEventCount":4,"evaluationEventCount":6,"eventsSha256":"beae2c0f78b992a3137db4d304f9b7ed861ab1b12dd48100f436aa7446193262","annotationsSha256":"364f9c95f515d9fc9445f4a94adff78fa9f29c0a79f5e22602de756c75beb0c4","corpusManifestSha256":"55cebbb3af43136f9a3e1b1c7f62f19add357af2d9efce2cad6a4503cef137e0","replayManifestSha256":"d56fcfb880236428c2331f2c923ae0e8ecb30002eff94d72a43dbf4452d0cd68"},{"scenarioId":"kit.warmup-cold-start.v1","scenarioVersion":"1.0.0","family":"warmup-cold-start","scenarioPath":"scenarios/kit.warmup-cold-start.v1.json","scenarioSha256":"40768fb1a32a3847fe2c70f75e21a9714b2f693cc0b7c1a9110b075008a5041a","seed":"kit-ref-warmup-cold-start-1","corpusId":"corpus.kit.warmup-cold-start.v1.ae11e2a00307","corpusPath":"corpora/kit.warmup-cold-start","representationMode":"feature-level","eventCount":7,"warmupEventCount":1,"evaluationEventCount":6,"eventsSha256":"3690571ddd94f2bd0fcd5d2c26fe91caa9eeed7c64e13c5d6b160ed00c04abb6","annotationsSha256":"affbdf01246c161418870a253bbb7a3a727504124abc11d67e134f515526f4b2","corpusManifestSha256":"2765a6c92899f0213bac87aa55bc3e93b83b35249d66ee3ed663d0f1b75179bb","replayManifestSha256":"ca086805d1cad023705b6e4920cb00ad6e9bb93873ec46e2964c76df69343ef7"}],"notes":"Derived inventory of repository-owned Kit reference corpora. Synthetic evaluation evidence only."}
